{
  "$schema": "./Invoke-Win11Debloat.manifest.schema.json",
  "name": "Win11Debloat",
  "version": "1.0.0",
  "description": "Switch-style manifest for Windows 11 25H2 debloat operations. Each entry has 'enabled' (bool); set to false to skip while preserving the audit trail. AppX uses two pattern lists: 'protect' wins over 'allow', and any provisioned/per-user package not matching either is removed. A pattern entry with enabled=false acts as if it were absent from the list.",
  "lastModifiedUtc": "2026-04-26T00:00:00Z",

  "appx": {
    "protect": [
      { "pattern": "Microsoft.AAD.BrokerPlugin",                "description": "Entra/AAD token broker",         "enabled": true },
      { "pattern": "Microsoft.AccountsControl",                 "description": "Credential UI",                  "enabled": true },
      { "pattern": "Microsoft.BioEnrollment",                   "description": "Windows Hello",                  "enabled": true },
      { "pattern": "Microsoft.CredDialogHost",                  "description": "Credential dialog",              "enabled": true },
      { "pattern": "Microsoft.LockApp",                         "description": "Lock screen",                    "enabled": true },

      { "pattern": "Microsoft.Windows.ShellExperienceHost",     "description": "Shell experience host",          "enabled": true },
      { "pattern": "Microsoft.Windows.StartMenuExperienceHost", "description": "Start menu experience host",     "enabled": true },
      { "pattern": "Microsoft.Windows.PeopleExperienceHost",    "description": "People experience host",         "enabled": true },
      { "pattern": "MicrosoftWindows.Client.FileExp",           "description": "File Explorer",                  "enabled": true },
      { "pattern": "windows.immersivecontrolpanel",             "description": "Settings",                       "enabled": true },

      { "pattern": "MicrosoftWindows.Client.CBS",               "description": "Core platform CBS",              "enabled": true },
      { "pattern": "MicrosoftWindows.Client.Core",              "description": "Core platform",                  "enabled": true },
      { "pattern": "MicrosoftWindows.Client.CoreAI",            "description": "Core platform AI",               "enabled": true },
      { "pattern": "MicrosoftWindows.Client.OOBE",              "description": "OOBE client",                    "enabled": true },
      { "pattern": "MicrosoftWindows.Client.Photon",            "description": "Core platform Photon",           "enabled": true },
      { "pattern": "MicrosoftWindows.UndockedDevKit",           "description": "Undocked dev kit",               "enabled": true },

      { "pattern": "Microsoft.Windows.CloudExperienceHost",      "description": "Cloud experience host",         "enabled": true },
      { "pattern": "Microsoft.Windows.OOBENetworkCaptivePortal", "description": "OOBE captive portal",           "enabled": true },
      { "pattern": "Microsoft.Windows.OOBENetworkConnectionFlow","description": "OOBE network flow",             "enabled": true },

      { "pattern": "Microsoft.AsyncTextService",                "description": "Async text service",             "enabled": true },
      { "pattern": "Microsoft.ECApp",                           "description": "Eye Control",                    "enabled": true },
      { "pattern": "Microsoft.Windows.NarratorQuickStart",      "description": "Narrator Quick Start",           "enabled": true },
      { "pattern": "Microsoft.Ink.Handwriting*",                "description": "Handwriting (in-use during run)","enabled": true },

      { "pattern": "Microsoft.Windows.Apprep.ChxApp",           "description": "SmartScreen",                    "enabled": true },
      { "pattern": "Microsoft.Windows.AssignedAccessLockApp",   "description": "Kiosk mode",                     "enabled": true },
      { "pattern": "Microsoft.Windows.ParentalControls",        "description": "Parental Controls",              "enabled": true },
      { "pattern": "Microsoft.Windows.SecureAssessmentBrowser", "description": "Secure Assessment Browser",      "enabled": true },

      { "pattern": "Microsoft.Windows.CapturePicker",           "description": "Capture picker",                 "enabled": true },
      { "pattern": "Microsoft.Windows.ContentDeliveryManager",  "description": "Content Delivery Manager",       "enabled": true },
      { "pattern": "Microsoft.Windows.PinningConfirmationDialog","description": "Pin confirmation dialog",       "enabled": true },
      { "pattern": "Microsoft.Windows.PrintQueueActionCenter",  "description": "Print queue action center",      "enabled": true },
      { "pattern": "Microsoft.Windows.XGpuEjectDialog",         "description": "GPU eject dialog",               "enabled": true },
      { "pattern": "Microsoft.MicrosoftEdgeDevToolsClient",     "description": "Edge dev tools client",          "enabled": true },
      { "pattern": "Microsoft.PPIProjection",                   "description": "Miracast",                       "enabled": true },
      { "pattern": "Microsoft.Win32WebViewHost",                "description": "Win32 WebView host",             "enabled": true },
      { "pattern": "Microsoft.XboxGameCallableUI",              "description": "Xbox game callable UI",          "enabled": true },
      { "pattern": "Windows.CBSPreview",                        "description": "CBS preview",                    "enabled": true },
      { "pattern": "Windows.PrintDialog",                       "description": "Print dialog",                   "enabled": true },

      { "pattern": "Microsoft.Windows.AugLoop.CBS",             "description": "AugLoop CBS",                    "enabled": true },
      { "pattern": "Microsoft.WindowsAppRuntime.*",             "description": "Windows App Runtime family",     "enabled": true },

      { "pattern": "MicrosoftWindows.*.Livtop",                 "description": "Obfuscated Copilot/AI framework (Livtop)", "enabled": true },
      { "pattern": "MicrosoftWindows.*.Speion",                 "description": "Obfuscated Copilot/AI framework (Speion)", "enabled": true },
      { "pattern": "MicrosoftWindows.*.Voiess",                 "description": "Obfuscated Copilot/AI framework (Voiess)", "enabled": true },
      { "pattern": "MicrosoftWindows.*.InpApp",                 "description": "Obfuscated Copilot/AI framework (InpApp)", "enabled": true },
      { "pattern": "MicrosoftWindows.*.Filons",                 "description": "Obfuscated Copilot/AI framework (Filons)", "enabled": true },
      { "pattern": "MicrosoftWindows.*.Tasbar",                 "description": "Obfuscated Copilot/AI framework (Tasbar)", "enabled": true }
    ],
    "allow": [
      { "pattern": "Microsoft.DesktopAppInstaller",  "description": "winget",                                  "enabled": true },
      { "pattern": "Microsoft.SecHealthUI",          "description": "Defender UI",                             "enabled": true },
      { "pattern": "Microsoft.StorePurchaseApp",     "description": "Store purchase app",                      "enabled": true },
      { "pattern": "Microsoft.VCLibs*",              "description": "VC++ runtime libs",                       "enabled": true },
      { "pattern": "Microsoft.UI.Xaml*",             "description": "WinUI runtime",                           "enabled": true },
      { "pattern": "Microsoft.NET.Native*",          "description": "NET native runtime",                      "enabled": true },
      { "pattern": "Microsoft.WindowsStore",         "description": "Microsoft Store",                         "enabled": true },
      { "pattern": "Microsoft.WindowsNotepad",       "description": "Notepad",                                 "enabled": true },
      { "pattern": "Microsoft.WindowsTerminal",      "description": "Terminal",                                "enabled": true },
      { "pattern": "Microsoft.WindowsCalculator",    "description": "Calculator",                              "enabled": true },
      { "pattern": "Microsoft.Paint",                "description": "Paint",                                   "enabled": true },
      { "pattern": "Microsoft.ScreenSketch",         "description": "Snipping Tool",                           "enabled": true },
      { "pattern": "Microsoft.HEIFImageExtension",   "description": "HEIF image extension",                    "enabled": true },
      { "pattern": "Microsoft.HEVCVideoExtension",   "description": "HEVC video extension",                    "enabled": true },
      { "pattern": "Microsoft.WebMediaExtensions",   "description": "Web media extensions",                    "enabled": true },
      { "pattern": "Microsoft.WebpImageExtension",   "description": "WebP image extension",                    "enabled": true },
      { "pattern": "Microsoft.RawImageExtension",    "description": "RAW image extension",                     "enabled": true },
      { "pattern": "Microsoft.VP9VideoExtensions",   "description": "VP9 video extension",                     "enabled": true },
      { "pattern": "Microsoft.AV1VideoExtension",    "description": "AV1 video extension",                     "enabled": true },
      { "pattern": "MicrosoftCorporationII.QuickAssist", "description": "Helpdesk remote assist",              "enabled": true },
      { "pattern": "Microsoft.Winget.Source",        "description": "winget source cache",                     "enabled": true },
      { "pattern": "1527c705-839a-4832-9118-54d4Bd6a0c89", "description": "FilePicker (system AppX, throws 0x80070032)", "enabled": true },
      { "pattern": "c5e2524a-ea46-4f67-841f-6a9465d9d515", "description": "FileExplorer (system AppX, throws 0x80070032)", "enabled": true },
      { "pattern": "E2A4F912-2574-4A75-9BB0-0D023378592B", "description": "AppResolverUX (system AppX, throws 0x80070032)", "enabled": true },